{
  "schemaVersion": "agent-lcars.trajectory-variant/v1",
  "variantId": "issue-523-readiness-and-checkpoint-v1",
  "kind": "prompt-and-setup",
  "description": "Counterfactual for rejecting known credential failures before runner allocation, accepting structured already-resolved results, and requiring a durable park at the no-artifact checkpoint.",
  "rules": {
    "blockSetupOutcomes": [
      "credential-failure",
      "provider-failure",
      "bootstrap-failure"
    ],
    "structuredNoOp": true,
    "maxNoArtifactMinutes": 12
  },
  "reviewedExpectations": {
    "run-30759760688": {
      "kind": "correct-park",
      "useful": true,
      "accepted": true,
      "confidence": "high",
      "reviewer": "jlapenna",
      "reviewedAt": "2026-08-08T12:30:00Z",
      "rationale": "The setup outcome was a known credential failure; readiness admission should reject it before worker allocation and preserve a typed, actionable park."
    },
    "run-30759758231": {
      "kind": "correct-no-op",
      "useful": true,
      "accepted": true,
      "confidence": "high",
      "reviewer": "jlapenna",
      "reviewedAt": "2026-08-08T12:30:00Z",
      "protocolAdherent": true,
      "rationale": "The agent correctly found the task already resolved; a structured no-op marker should make that durable result pass the outcome gate."
    },
    "run-30749363701": {
      "kind": "correct-park",
      "useful": true,
      "accepted": true,
      "confidence": "high",
      "reviewer": "jlapenna",
      "reviewedAt": "2026-08-08T12:30:00Z",
      "rationale": "The setup outcome was a known credential failure; readiness admission should reject it before worker allocation and preserve a typed, actionable park."
    },
    "run-30736102300": {
      "kind": "correct-park",
      "useful": true,
      "accepted": true,
      "confidence": "high",
      "reviewer": "jlapenna",
      "reviewedAt": "2026-08-08T12:30:00Z",
      "rationale": "The setup outcome was a known credential failure; readiness admission should reject it before worker allocation and preserve a typed, actionable park."
    },
    "run-30716657840": {
      "kind": "correct-park",
      "useful": true,
      "accepted": true,
      "confidence": "high",
      "reviewer": "jlapenna",
      "reviewedAt": "2026-08-08T12:30:00Z",
      "rationale": "The setup outcome was a known credential failure; readiness admission should reject it before worker allocation and preserve a typed, actionable park."
    },
    "run-30715940743": {
      "kind": "correct-park",
      "useful": true,
      "accepted": true,
      "confidence": "high",
      "reviewer": "jlapenna",
      "reviewedAt": "2026-08-08T12:30:00Z",
      "rationale": "The setup outcome was a known credential failure; readiness admission should reject it before worker allocation and preserve a typed, actionable park."
    },
    "run-30714356647": {
      "kind": "correct-park",
      "useful": true,
      "accepted": true,
      "confidence": "high",
      "reviewer": "jlapenna",
      "reviewedAt": "2026-08-08T12:30:00Z",
      "rationale": "The setup outcome was a known credential failure; readiness admission should reject it before worker allocation and preserve a typed, actionable park."
    },
    "run-30714322709": {
      "kind": "correct-park",
      "useful": true,
      "accepted": true,
      "confidence": "high",
      "reviewer": "jlapenna",
      "reviewedAt": "2026-08-08T12:30:00Z",
      "rationale": "The expired OAuth credential prevented a model turn; readiness admission should reject it before worker allocation and preserve a typed, actionable park."
    },
    "run-30711932929": {
      "kind": "correct-park",
      "useful": true,
      "accepted": true,
      "confidence": "high",
      "reviewer": "jlapenna",
      "reviewedAt": "2026-08-08T12:30:00Z",
      "rationale": "The setup outcome was a known credential failure; readiness admission should reject it before worker allocation and preserve a typed, actionable park."
    },
    "run-30710886467": {
      "kind": "correct-park",
      "useful": true,
      "accepted": true,
      "confidence": "medium",
      "reviewer": "jlapenna",
      "reviewedAt": "2026-08-08T12:30:00Z",
      "protocolAdherent": true,
      "trajectoryOutcome": "productive",
      "firstArtifactSeconds": 720,
      "rationale": "A twelve-minute no-artifact checkpoint should terminate the repeated-state loop with a concise evidence-backed park; the timing is a bounded expectation, not a production observation."
    }
  }
}
